id,workcenter_cd,cause_code,failure_type,failure_start,failure_end,downtime_hours,severity,description
EF-001,WC-COATING-01,설비_고장,코팅 헤드 고장,2024-01-18,2024-01-19,18.5,HIGH,코팅 헤드 노즐 막힘으로 불균일 코팅 발생
EF-002,WC-FORMATION-02,설비_고장,화성 챔버 온도 제어 불량,2024-01-25,2024-01-26,28.0,HIGH,온도 센서 고장으로 화성 온도 45°C → 52°C 상승
EF-003,WC-STACKING-01,설비_고장,스태킹 로봇 위치 오차,2024-02-08,2024-02-08,6.5,MEDIUM,로봇 캘리브레이션 오류로 적층 위치 ±0.5mm 오차
EF-004,WC-MIXING-02,설비_고장,믹서 모터 베어링 마모,2024-02-14,2024-02-16,42.0,HIGH,베어링 마모로 진동 증가 및 믹싱 불균일
EF-005,WC-WELDING-01,설비_고장,레이저 출력 저하,2024-02-22,2024-02-23,22.0,MEDIUM,레이저 광원 노화로 용접 강도 15% 저하
EF-006,WC-PRESSING-01,설비_고장,프레스 압력 불안정,2024-03-05,2024-03-06,18.0,MEDIUM,유압 펌프 누유로 압력 변동 ±5%
EF-007,WC-INSPECTION-01,설비_고장,검사 장비 센서 고장,2024-03-12,2024-03-12,4.5,LOW,전압 측정 센서 드리프트로 측정 오차 발생
